,Date,Location / Operator,Aircraft Type / Registration,Fatalities
0,01 Jan 2007,"Off Parepare, IndonesiaAdam Air",Boeing B-737-4Q8PK-KKW,102/102(0)
1,09 Jan 2007,"Near Balad Air Base, IraqMoldovan Aeriantur-M Air Cargo",Antonov 26B-100ER-26068,34/35(0)
2,20 Jan 2007,"Near Baghdad, IraqMilitary - US Army",Sikorsky UH-60L Black Hawk?,12/12(0)
3,25 Jan 2007,"Pau, FranceRegional Compagnie Aerienne Europeenne",Fokker 100F-GMPG,0/54(1)
4,07 Mar 2007,"Yogyakarta, IndonesiaGaruda Indonesia Airlines",Boeing B-737-497PK-GZC,22/140(0)
5,08 Mar 2007,"Princeville, HawaiiHeli-USA Airways",Aerospatiale AS350BA RotocraftN354NT,4/7(0)
6,11 Mar 2007,"Hanea, Kauai, HawaiiInter-Island",Mc Donnell Douglas 369FF RotocraftN911VC,1/5(0)
7,14 Mar 2007,"Fazenda Nossa Senhora de Lourdes, BrazilBahia Taxi Aéreo  Bahia Taxi Aéreo  Bahia Taxi Aéreo",Rockwell 500S Shrike CommanderPP-SEC,4/4(0)
8,17 Mar 2007,"Samara, RussiaUTAir Airlines",Tuolev 134AKRA-65021,6/57(0)
9,23 Mar 2007,"Mogadishu, SomaliaTransaviaexport Airlines",Ilushin Il-76TDEW-78849,11/11(0)
10,25 Apr 2007,"Near Kopinang, GuyanaAir Services",Pilatus Britten Norman BN-2A-27 Islander8R-GET,3/5(0)
11,27 Apr 2007,"Shatoi, ChechnyaMilitary - Russian",Mi 8?,18/18(0)
12,05 May 2007,"Near Dizangue, CameroonKenya Airways",Boeing B-737-8AL5Y-KYA,114/114(0)
13,06 May 2007,"Near El-Thamad, EgyptMilitary - French Air Force",de Havilland Canada DHC-6 Twin Otter742/CB,9/9(0)
14,17 May 2007,"Walikale Airstrip, CongoSafe Air Complany",Let 410UVPTN-AHE,3/3(0)
15,24 May 2007,"Near Pampa Hermosa, PeruMilitary - Peruvian Air Force",de Havilland Canada DHC-6 Twin Otter 300FAP-303,13/20(0)
16,03 Jun 2007,"Freetown, Sierra LeoneParamount Airlilnes",Mi-8?,21/22(0)
17,04 Jun 2007,"Near Milwaukee, WisconsonUniversity of Michigan Health System",Cessna 550 Citation IIN550BP,6/6(0)
18,13 Jun 2007,"Selenge province, MongoliaMongolian Defense Ministry",Mi-8?,15/22(0)
19,21 Jun 2007,"Near Kamina, CongoKaribu Airways",Let 410UVP9Q-CEU,1/25(0)
20,25 Jun 2007,"Near Sihanoukville, CambodiaPMT Air",Antonov AN-24VXU-U4A,22/22(0)
21,28 Jun 2007,"M'Banza Congo, AngolaTAAG Angola Airlines",Boeing 737-2M2D2-TBP,5/78(0)
22,05 Jul 2007,"Culiacan, MexicoJett Paqueteria SA",North American CT-39A SabrelineXA-TFL,3/3(6)
23,08 Jul 2007,"Muncho Lake, British Columbia, CanadaLiard Air",de Havilland DHC-6 Twim Otter 100C-FAWC,1/5(0)
24,17 Jul 2007,"Sao Paulo, BrazilTAM (Brazil)",Airbus A-320-233PR-MBK,187/187(12)
25,23 Jul 2007,"Near Shinile, EthiopiaDjibouti Airlines",Antonov AN-26VEX-030,1/9(0)
26,24 Jul 2007,"Rudyerd Bay, AlaskaTaquan Air Service",de Havilland DHC-2 MK.1 BeaverN995WA,5/5(0)
27,29 Jul 2007,"Moscow, RussiaAtran",Antonov AN-12BPRA-93912,9/9(0)
28,09 Aug 2007,"Off Moorea, French PolynesiaAir Moorea",de Havilland Canada DHC-6 Twin Otter 300F-OIQ,20/20(0)
29,16 Aug 2007,"Near Ketchikan, AlaskaSeaWind Aviation",de Havilland Canada DHC-2 BeaverN345KA,6/10(0)
30,20 Aug 2007,"Okinawa, JapanChina Airlines",Boeing 737-809B-18616,0/165(0)
31,22 Aug 2007,"Near Curitiba, BrazilTwo Taxi Aero",Embraer EMB-110P1 BandeirantPT-SDB,2/2(0)
32,22 Aug 2007,"Near Kirkuk, IraqMilitary - U.S. Army",UH-60 Blackhawk helilcopter?,14/14(0)
33,26 Aug 2007,"Kongolo, Democratic Republic CongoGreat Lakes Business Complany",Antonov AN-329Q-CAC,14/15(0)
34,07 Sep 2007,"Goma, Democratic Republic CongoGalaxy Kavatsi Airlines",Antonov AN-12BP4L-SAS,8/8(0)
35,16 Sep 2007,"Phuket, ThailandOne-Two-Go Airlines",McDonnell Douglas MD-82HS-OMG,90/130(0)
36,24 Sep 2007,"Malemba Nkulu, DR CongoKaribu Airways",Let 4109Q-CVL,1/6(0)
37,04 Oct 2007,"Kinshasa, DR CongoAfrica One Congo",Antonov AN-269Q-COS,21/22(30)
38,08 Oct 2007,"Near Cubarral, ColombiaNacional de Aviacion",Let 410 UVP-E10AHK-4055,17/17(0)
39,08 Nov 2007,"Khartoum, SudanJuba Air Cargo",Antonov 12ST-JUA,0/4(2)
40,30 Nov 2007,"Near Isparta, TurkeyAtlasjet Airlines",McDonnell Douglas MD-83TC-AKM,57/57(0)
41,03 Dec 2007,"Off Whittier, AlaskaEvergreen Alaska Helicopters, Inc.",Eurocopter Deutschland BK117C1N141LG,4/4(0)
42,05 Dec 2007,"Columbus, OhioCastle Aviation",Cessna 208B Caravan I Super CargomasterN28MG,2/2(0)
43,04 Jan 2008,"Los Roques, VenezuelaTransaven",Let 410 UVP-E3YV2081,18/18(0)
44,12 Jan 2008,"Blace, MacedoniaMilitary - Macedonian Air Force",Mi-17 HelicopterVAM-304,11/11(0)
45,17 Jan 2008,"London, EnglandBritish Airways",Boeing 777-236ERG-YMMM,0/152(0)
46,23 Jan 2008,"Miroslawiec, PolandMilitary - Polish Air Force",CASA C-295M019,20/20(0)
47,26 Jan 2008,"Near Malinau, IndonesiaDirgantara Air Service",CASA NC-212-200PK-VSE,3/3(0)
48,21 Feb 2008,"Merida, VenezuelaSanta Barbara Airlines",ATR-42-300YV-1449,46/46(0)
49,26 Feb 2008,"Off Macae , Rio de Janeiro , ArgentinaBHS - Brazilian Helicopter Service Air Taxi",Eurocopter AS332L2 Super PumaPP-MUM,5/20(0)
50,03 Mar 2008,"Near Bethani, NepalUnited Nations Mission",Mi-17?,10/10(0)
51,03 Apr 2008,"Lawa, SurinameBlue Wing Airlines",Antonov An-28PZ-TSO,19/19(0)
52,09 Apr 2008,"Bundeena, AustraliaAvtex Air Services",Swearingen SA227AC Metroliner IIIVH-OZA,1/1(0)
53,11 Apr 2008,"Chrisinau, MoldovaKata Transportation",Antonov An-32ST-AZL,8/8(0)
54,15 Apr 2008,"Goma, CongoHewa Bora Airways",McDonnell Douglas DC-9-519Q-CHN,0/85(47)
55,16 Apr 2008,"Off Annobon Island, Equatorial GuineaMilitary - Government of Equatorial Guinea",Antonov An-32B3C-5GE,13/13(0)
56,28 Apr 2008,"Off Crimea, Black SeaNaftogaz",Mil Mi-8TUR-24275,20/20(0)
57,17 May 2008,"Stehekin, WashingtonChelan Air Service",de Havilland Canada DHC-2 Mark I BeaverN5998Q,2/5(0)
58,24 May 2008,"Two Harbors, Catalina Island, CaliforniaIsland Express Helicopter Service",Eurocopter AS350D AstarN67GE,4/6(0)
59,26 May 2008,"Near Chelyabinsk, RussiaMoskovia Airlines",Antonov An-12RA-12957,9/9(0)
60,29 May 2008,"Panama City, PanamaMilitary - Servicio Aereo Nacional",Bell UN-1N HueySAN-100,11/12(0)
61,30 May 2008,"Tegucigalpa, HondurasTACA International Airlines",Airbus A-320-233EI-TAF,3/136(2)
62,08 Jun 2008,"Huntsville, TexasPHI Air Medical",Bell 407N416PH,4/4(0)
63,10 Jun 2008,"Khartoum, SudanSudan Airways",Airbus A-310-324ST-ATN,32/214(0)
64,18 Jun 2008,"Hyannis, MassachusettsWiggins Airways",de Havilland Canada DHC-6 Twin Otter 100N656WA,1/1(0)
65,20 Jun 2008,"Bannang Sata, ThailandMilitary - Thai Army",Bell UH-1N?,10/10(0)
66,26 Jun 2008,"Near Salak Mountain, IndonesiaMilitary - Indonesian Air Force",CASA NC-212A-2106,18/18(0)
67,27 Jun 2008,"Near Malakal, SudanJuba Air Cargo",Antonov 12BKST-ARN,7/8(0)
68,29 Jun 2008,"Flagstaff, ArizonaAir Methods / Classic Helicopters",Bell 407 / Bell 407N407GA / N407MJ,6/7(0)
69,30 Jun 2008,"Near Khartoum, SudanAbabeel Aviaition",Ilysushin Il-76TDST-WTB,4/4(0)
70,06 Jul 2008,"Saltillo, MexicoUSA Jet Airlines",Douglas DC9-15FN199US,1/2(0)
71,07 Jul 2008,"Near Bogota, ColombiaCenturian Air Cargo",Boeing B-747-209BSFN714CK,0/8(3)
72,31 Jul 2008,"Owatonna, MinnesotaEast Coast Jets",British Aerospace BAe-125-800AN818MV,8/8(0)
73,03 Aug 2008,"North Vancouver Island, British Colombia, CanadaPacific Coastal Airlines",Grumman G-21A GooseC-GPCD,5/7(0)
74,05 Aug 2008,"Near Junction City, CaliforniaJunction City Fire Department",Sikorsky S-61NN612AZ,9/13(0)
75,06 Aug 2008,"Sunat Tanon, ThailandMilitary - Royal Thai Air Force",Bell Huey UH-1H?,10/10(0)
76,13 Aug 2008,"K-50 Airport, SomaliaFly 540",Fokker F-27 Friendship 5005Y-BVF,3/3(0)
77,20 Aug 2008,"Madrid, SpainSpanair",McDonnell Douglas MD-82EC-HFP,154/172(0)
78,24 Aug 2008,"Bishkek, KyrgyzstanItek Air",Boeing B-737-219EX-009,68/90(0)
79,30 Aug 2008,"Near Toacaso, EcuadorConviasa",Boeing B-737-291YV-102T,3/3(0)
80,01 Sep 2008,"Columbus, OhioAir Tahoma",Convair CV-580N587X,3/3(0)
81,03 Sep 2008,"Off Dubai, United Arab EmiratesAerogulf",Bell 212A6-AVL,7/7(0)
82,14 Sep 2008,"Perm, RussiaAeroflot",Boeing B-737-505VP-BKO,88/88(0)
83,19 Sep 2008,"Columbia, South CarolinaGlobal Executive Aviation",Learjet 60N999LJ,4/6(0)
84,27 Sep 2008,"Camp Springs, MarylandMaryland State Police",Aerospatiale SA365N-1 Dauphin IIN92MD,4/5(0)
85,08 Oct 2008,"Lukla, NepalYeti Airlines",de Havilland Canada DHC-6 Twin Otter 3009N-AFE,18/19(0)
86,15 Oct 2008,"Aurora, IllinoisAir Angles Inc.",Bell 222N992AA,4/4(0)
87,13 Nov 2008,"Fallujah, IraqFalcon Aviation Group",Antonov An-12S9-SAO,7/7(0)
88,16 Nov 2008,"Thormanby Island, British Columbia, CanadaPacific Coastal Airlines",Grumman G-21A GooseC-FPCK,7/8(0)
89,27 Nov 2008,"Off Perpignan, FranceXL Airways leased from Air New Zealand",Airbus A320-232D-AXLA,7/7(0)
90,03 Dec 2008,"San Juan, Puerto RicoWebstas Aviation Services Inc.",Rockwell International 690BN318WA,3/3(0)
91,11 Dec 2008,"Off Sabine Pass, TexasRotorcraft Leasing Co",Bell 206-L4 Jet Ranger IIIN180AL,3/3(0)
92,15 Dec 2008,Off Turks and Caicos IslandsAlantis Aviation,Britten Norman BN-2A Trislander Mk3N650LP,12/12(0)
93,20 Dec 2008,"Denver, ColoradoContinental Airlines",Boeing 737-500N18611,0/115(0)
94,01 Jan 2009,"Lubock, TexasEmpire Airlines leased from FedEx",ATR-42-320N902FX,2/2(0)
95,04 Jan 2009,Near Houma LouisianaPetroleum Helicopters Inc,Sikorsky S-76C++N748P,8/9(0)
96,15 Jan 2009,"Adraskan district, AfghanistanAfghan Army",Mil Mi-17?,13/13(0)
97,15 Jan 2009,"New York, New YorkUS Airways",Airbus A320-214N106US,0/155(0)
98,07 Feb 2009,"Manacapuru, BrazilAerotaxi Manaus",Bandeirante EMB-110P1PT-SEA,24/28(0)
99,12 Feb 2009,"Clarence Center, New YorkContinental Connection/Colgan Air",Bombardier DHC-8-402 Q400N200WQ,49/49(1)
100,15 Feb 2009,"Chanco, ChileFlight Service",Bell UH-1HCC-CBW,13/13(0)
101,20 Feb 2009,"Luxor, EgyptAerolift",Antonov 12VS9-SVN,5/5(0)
102,25 Feb 2009,"Amsterdam, NetherlandsTurkish Airlines",Boeing 737-8F2TC-JGE,9/134(0)
103,09 Mar 2009,"Lake Victoria, UgandaAerolift",Ilyushin Il-76TS9-SAB,11/11(0)
104,12 Mar 2009,"Off St. Johns, NewfoundlandCougar Helicopters",Sikorsky S-92AC-GZCH,17/18(0)
105,22 Mar 2009,"Butte, MontanaEagle Cap Leasing",Pilatus PC-12/45N128CM,14/14(0)
106,23 Mar 2009,"Tokyo, JapanFedEx",McDonnell Douglas MD-11N526FE,2/2(0)
107,01 Apr 2009,"Off Crimond, ScotlandBond Offshore Helicopters",Eurocopter AS 332L2 Super Puma 2G-REDL,16/16(0)
108,06 Apr 2009,"Bandung, IndonesiaMilitary - Indonesian Air Force",Fokker F-27 Friendship 400MA-2703,24/24(0)
109,09 Apr 2009,"Near Wamena, IndonesiaAviastar Mandiri",British Aerospace BAe-146-300PK-BRD,6/6(0)
110,29 Apr 2009,"Massamba, Democratic Republic of CongoBako Air",Boeing B-737-200TL-ADM,7/7(0)
111,03 May 2009,"Near El Alto de Rubio, VenezuelaMilitary - Venezuelan Army",Mi-35EV08114,18/18(0)
112,20 May 2009,"Near Madiun, IndonesiaMilitary - Indonesian Air Force",Lockheed C-130 HerculesA-1325,112/112(2)
113,26 May 2009,"Near Isiro, Democratic Republic CongoService Air",Antonov An-269Q-CSA,4/4(?)
114,01 Jun 2009,"Atlantic Ocean, 570 miles northeast of Natal, BrazilAir France",Airbus A330-203F-GZCP,228/228(0)
115,07 Jun 2009,"Near Port Hope Simpson, Newfoundland, CanadaStrait Air",Britten-Norman BN-2A-27 IslanderC-FJJR,1/1(0)
116,08 Jun 2009,"State of Arunachal Pradesh, IndiaMilitary - Indian Air Force",Antonov An-32?,13/13(0)
117,29 Jun 2009,"Near Wamena, IndonesiaAviastar Mandiri",de Havilland Canada DHC-6 Twin Otter 300PK-BRO,3/3(0)
118,30 Jun 2009,"Off Mitsamiouli, ComorosYemenia Airway",Airbus A310-3247O-ADJ,152/153(0)
119,03 Jul 2009,"Near, Peshawar , PakistanMilitary - Pakistan Army",Mil Mi-17?,26/26(0)
120,15 Jul 2009,"Near Qazvin, IranCaspian Airlines",Tupolev 154MEP-CPG,168/168(0)
121,19 Jul 2009,"Kandahar Airport, AfghanistanVertical-T Air",Mil Mi-8?,16/21(0)
122,24 Jul 2009,"Mashad, IranAria Airlines",Ilyushin Il-62MUP-16208,16/153(0)
123,02 Aug 2009,"Ampisibil Village, IndonesiaMerpati Nusantara Airlines",de Havilland Canada DHC-6 Twin Otter 300PK-NVC,16/16(0)
124,04 Aug 2009,"Koh Samui, ThailandBangkok Airlines",ATR-72-212AHS-PGL,1/72(0)
125,08 Aug 2009,"New York, New YorkLiberty Helicopter Sightseeing Tours / Private",Eurocopter AS-350BA / Piper PA-32R-300N401lH / N71MC,9/9(0)
126,11 Aug 2009,"Near Port Moresby, Papua New Guinea Airlines PNG",de Havilland Canada DHC-6 Twin Otter 300P2-MCB,13/13(0)
127,26 Aug 2009,"Nganga Lingolo, CongoAero Fret Business",Antonov An-12BKTN-AIA,7/7(0)
128,08 Sep 2009,"Ugamsk Gorge, South KazakistanMilitary - Kazakhstan border guard service",Mil Mi-8?,10/13(0)
129,24 Sep 2009,"Merebank, South AfricaSA Airlink",British Aerospace Jetstream 41ZS-NRM,1/3(0)
130,25 Sep 2009,"Georgetown, South CarolinaOmniflight Helicopters Inc.",Eurocopter AS350-B2N417AE,3/3(0)
131,17 Oct 2009,"Manila, PhilippinesVictoria Air",Douglas DC-3CRPC550,4/4(0)
132,21 Oct 2009,"Sharjah, United Arab EmiratesAzzi",Boeing 707-330CST-AKW,6/6(0)
133,22 Oct 2009,"Off Bonaire, Netherlands AntillesDivi Divi Air",Britten-Norman BN-2A-8 IslandPJ-SUN,1/10(0)
134,01 Nov 2009,"Off Mongokhto, RussiaMilitary - Russian Navy",Tupolev Tu-142M3RF-76801,11/11(0)
135,01 Nov 2009,"Mirny, RussiaRussian Ministry of Interior",Ilyushin Il-76RF-76801,11/11(0)
136,12 Nov 2009,"Kigali, RwandaRwandair",Canadair CRJ-100ER5Y-JLD,1/15(0)
137,14 Nov 2009,"Near Reno, NevadaMountain Lifeflight",Aerospatiale AS350N5793P,3/3(0)
138,28 Nov 2009,"Shanghai, ChinaAvient Aviation",McDonnell Douglas MD-11FZ-BAV,3/7(0)
139,29 Nov 2009,"Lyall Harbour, BC, CanadaSeair Seaplanes",de Havilland Canada DHC-2 Beaver MK- 1C-GTMC,6/8(0)
140,22 Jan 2010,"Off Sand Point, AlaskaAlaska Central Express",Beechcraft 1900C-1N112AX,2/2(0)
141,25 Jan 2010,"Off Na'ameh, LebanonEthiopian Airlines",Boeing 737-8ASET-ANB,90/90(0)
142,25 Jan 2010,"Near Senador Jose Porfírio, BrazilPiquiatuba Taxi Aereo",Embraer EMB-110C BandeirantePT-TAF,2/10(0)
143,28 Jan 2010,"Cotabato City, PhilippinesMilitary - Philippine Air Force",GAF N22B Nomad18,8/8(1)
144,14 Feb 2010,"Near Saada, YemenMilitary - Yemeni Arm",Helicopter?,11/11(2)
145,10 Apr 2010,"Smolensk, RussiaMilitary - Polish Air Force",Tupolev 154M101,96/96(0)
146,10 Apr 2010,"Near Yelizovo, RussiaKamchatka Airlines",Mi-8?,10/18(?)
147,13 Apr 2010,"Monterey, MexicoAirborne Freight Company Union",Airbus A300B4-203FXA-TUE,5/5(2)
148,21 Apr 2010,"Pampanga, PhilippinesInterisland Airlines",Antonov An-12BPUP-AN216,3/6(0)
149,12 May 2010,"Tripoli, LibyaAfriqiyah Airways",Airbus A330-2025A-ONG,103/104(0)
150,15 May 2010,"Near Poeketi, SurinameBlue Wings Airlines",Antonv An-28PZ-TSV,8/8(0)
151,17 May 2010,"Salang pass, AfghanistanPamir Airlines",Antonv An-24BYA-PIS,44/44(0)
152,22 May 2010,"Mangalore, IndiaAir India Express",Boeing 737-8HGVT-AXV,159/166(0)
153,19 Jun 2010,"Yangadou, CameroonAero Service",CASA 212 AviocarTN-AFA,11/11(0)
154,23 Jun 2010,"Quebec, CanadaAéropro",Beechcraft A100 King AirC-FGIN,7/7(0)
155,05 Jul 2010,"Tuzla, RomaniaMilitary - Romainian Air Force",Antonov AN-253,12/14(0)
156,28 Jul 2010,"Islamabad, PakistanAirblue",Airbus A321-231AP-BJB,152/152(0)
157,28 Jul 2010,"Near Elmendorf AFB, AlaskaMilitary - US Air Force",McDonnell Douglas C-17A Globemaster III00-0173,4/4(0)
158,01 Aug 2010,"Near Denali National Park, AlaskaAll West Freight",Fairchild C-123KN709RR,3/3(0)
159,03 Aug 2010,"Igarka, RussiaKatekavia Airline",Antonov An-24 VRA-46524,12/15(0)
160,09 Aug 2010,"Near Dillingham, AlaskaGCI Communications Corp.",de Havilland Canada DH-3T OtterN455A,5/9(0)
161,16 Aug 2010,"San Andreas Island, ColombiaAIRES Colombia",Boeing B-737-73VHK-4882,2/131(0)
162,21 Aug 2010,"Off Kaminshak Bay, AlaskaBranch River Air Service",de Havilland Canada DHC-2 BeaverN9313Z,4/4(0)
163,24 Aug 2010,"Bastipur, NepalAgni Air",Dornier 228-1019NAHE,14/14(0)
164,24 Aug 2010,"Yichun, ChinaHenan Airlines",Embraer ERJ-190-100LRB-3130,44/96(0)
165,25 Aug 2010,"Bandundu, Congo Democratic RepublicFilair",Let 410UVP-E9Q-CCN,19/20(0)
166,27 Aug 2010,"Buena Vista, VenezuelaMilitary - Venezuelan National Guard",Mi 17V-5GN10139,10/10(0)
167,03 Sep 2010,"Dubai, United Arab EmiratesUnited Parcel Service- UPS",Boeing B747-44AFN571UP,2/2(0)
168,04 Sep 2010,Fox Glacier AirstripSky Dive New Zealand,Fletcher FU-24-954ZK-EUF,9/9(0)
169,13 Sep 2010,"Puerto Ordaz, VenezuelaConviasa Airline",ATR 42-320YV-1010,17/51(0)
170,21 Sep 2010,"Chopan district, Zabul Province, AfghanistanInternational Security Assistance Force",Sikorsky UH-60 Black Hawk	93-26517,10/13(0)
171,06 Oct 2010,"Rasht Valley, Tajikistan	Military - Tajik National Guard",Mi-8?,28/28(0)
172,12 Oct 2010,"Near Kabul, AfghanistanNational Air Cargo",Lockheed L-100 Hercules5X-TUC,8/8(0)
173,21 Oct 2010,"Near Bugulumisa, CongoTracep",Let 410UVP9Q-CUA,2/2(0)
174,04 Nov 2010,"Near Guasimal, CubaAerocaribbean",ATR-72-212CU-T1549,68/68(0)
175,05 Nov 2010,"Near Karachi, PakistanJS Air",Beechcraft 1900C-1AP-BJD,21/21(0)
176,25 Nov 2010,"Strezhevoy, RussiaNARZ",Mil Mi-8TRA-22376,7/10(0)
177,28 Nov 2010,"Karachi, PakistanSun Way",Ilyushin Il-76TD4L-GNI,8/8(4)
178,04 Dec 2010,"Moscow, RussiaDagestan Airlines",Tupolev Tu-154MRA-85744,2/169(0)
179,15 Dec 2010,"Palunge Hill, NepalTara Air",de Havilland Canada DHC-6 Twin Otter9N-AFX,22/22(0)
180,01 Jan 2011,"Surgut, RussiaKogalmavia",Tupolev Tu-154B-2RA-85588,3/124(0)
181,09 Jan 2011,"Orumiyeh, IranIran Air",Boeing B-727-286EP-IRP,77/105(0)
182,08 Feb 2011,"Off Plettenberg Bay, South AfricaMajuba Aviation",Pilatus PC-12/47ZS-GAA,9/9(0)
183,10 Feb 2011,"Cork, IrelandManx2",Swearingen SA-227BC Metro IIIEC-ITP,6/12(0)
184,14 Feb 2011,"Near Santa Ana Francisco Morazan, HondurasCentral American Airways",Let L-410 UVPE-20HR-AUQ,14/14(0)
185,21 Mar 2011,"Pointe-Noire, CongoTrans Air Cargo",Antonov 12BPTN-AGK,9/9(14)
186,04 Apr 2011,"Kinshasa, CongoUnited Nations",Canadair CL-600 CRJ-100ER4L-GAE,32/33(0)
187,19 Apr 2011,"Tawang, India	Pawan Hans Helicopters Ltd.",Mil Mi-172	VT-PHF,18/23(0)
188,21 Apr 2011,"Manaus, Brazil	AmazonavesAir Taxi",Embraer/Piper EMB-810C SenecaPT-EFS,7/7(0)
189,07 May 2011,"Off Kaimana, IndonesiaMerpati Nusantara Airlines",Xian MA-60PK-MZK,27/27(0)
190,18 May 2011,"Near Prahuaniyeu, ArgentinaSOL Lineas Aereas",Saab 340ALV-CEJ,22/22(0)
191,20 Jun 2011,"Petrozavodsk, RussiaRusAir Airlines",Tupolev Tu-134RA-65691,47/52(0)
192,06 Jul 2011,"Near Bagram Air Base, AfghanistanSilk Way Airlines",Ilyushin76TD4K-AZ55,9/9(0)
193,08 Jul 2011,"Kisangani, CongoHewa Bora Airways",Boeing B-727-1009Q-COP,77/115(0)
194,11 Jul 2011,"Near Strezhevoy, RussiaAngara Airlines",Antonov An-24RVRA-47302,7/37(0)
195,13 Jul 2011,"Recife, BrazilNOAR Linhas Aéreas",Let L-401UVP-20PR-NOB,16/16(0)
196,26 Jul 2011,"Near Guelmim, MoroccoMilitary - Royal Moroccan Air Force",Lockheed C-130 HerculeCNA-OQ,80/80(0)
197,28 Jul 2011,"Off Jeju, South KoreanAsiana Airlines",Boeing B-747-48EFHL-7604,2/2(0)
198,06 Aug 2011,"Tangi Valley, AfghanistanMilitary - U.S. Army",Boeing CH-47 Chinook?,38/38(0)
199,09 Aug 2011,"Near Omsukchan, RussiaAvis Amur",Antonov 12RA-11125,11/11(0)
200,20 Aug 2011,"Resolute Bay, Nunavut, CanadaFirst Air",Boeing B-737-210C(A) CombiC-GNWN,12/15(0)
201,26 Aug 2011,"Mosby, MissouriLifeNet",Eurocopter AS350B2N352LN,4/4(0)
202,02 Sep 2011,"Juan Fernandez Island, ChileChilean Air Force",CASA C-212 Aviocar 300DF966,21/21(0)
203,06 Sep 2011,"Near Trinidad, BoliviaAerocon",Swearingen SA-227BC Metroliner IIICP-2548,8/9(0)
204,07 Sep 2011,"Yaroslavl, RussiaYAK Service",Yakovlev 42DRA-42434,44/45(0)
205,14 Sep 2011,"Huambo, AngolaMilitary - FANA Forca Aerea Nacional Angolana",Embraer 120ER BrasiliaT-500,30/36(0)
206,16 Sep 2011,"Reno, NevadaPrivate - Aero Trans Corp",North American P-51D-15-NA MustangN79111,1/1(10)
207,22 Sep 2011,"Yellowknife, Northwest Territories, CanadaArctic Sunwest Charters",De Havilland Canada DHC-6-300 Twin OtterC-GARW,2/9(0)
208,25 Sep 2011,"Near Kathmandu, NepalBuddha Air",Beechcraft 1900D9N-AEK,19/19(0)
209,29 Sep 2011,"Near Bohorok, IndonesiaNusantara Buana Air",CASA NC-212 Aviocar 200PK-TLF,18/18(0)
210,13 Oct 2011,"Near Madang, Papua New GuineaAirline PNG",de Havilland Canada DHC-8-102P2-MCJ,28/32(0)
211,27 Oct 2011,"Vancouver, BC, CanadaNorthern Thunderbird Air Inc.",Beechcraft 100 King AirC-GXRX,1/9(0)
212,10 Nov 2011,"Near Kilohana, Molokai, HawaiiBlue Hawaiian Helicopter",Eurocopter EC-130 B4N11QV,5/5(0)
213,11 Nov 2011,"Near Santa Catarina Atoyzingo, MexicoFuerza Aerea Mexicana",Aerospatiale AS 332L1 Super PumaXC-UHM,8/8(0)
214,07 Dec 2011,"Near Henderson, NevadaSundance Helicopters Inc.",Aerospatiale AS-350 B2 EcureuilN37SH,5/5(0)
215,26 Dec 2011,"Green Grove, Florida?",Bell 206BN5016M,3/3(0)
216,30 Jan 2012,"Namoya, CongoTRACEP Congo Aviation",Antonov AN-289Q-CUN,3/5(0)
217,15 Mar 2012,"Near San Juan, Puerto RicoJet One Express",Convair CV-340N153JR,2/2(0)
218,16 Mar 2012,"Kabul, AfghanistanMilitary - Turkish Army (NATO)",Sikorsky S-70A-2810981,12/12(4)
219,02 Apr 2012,"Tyumen, RussiaUTAir",ATR 72-201VP-BYZ,33/43(0)
220,20 Apr 2012,"Islamabad, PakistanBhoja Airlines",Boeing 737-236AP-BKC,127/127(0)
221,30 Apr 2012,"Sabanagrande, ColombiaMilitary -Fuerza Aerea Colombiana",Bell 212FAC 4020,13/13(0)
222,09 May 2012,"Near Cidahu, IndonesiaSukhoi",Sukhoi Superjet 100-95RA-97004,45/45(0)
223,14 May 2012,"Jomsom, NepalAgni Air",Dornier 228-2129N-AIG,15/21(0)
224,02 Jun 2012,"Accra, GhanaAllied Air",Boeing B-727-2005N-BJN,0/4(12)
225,03 Jun 2012,"Lagos, NigeriaDana Air",McDonnell Douglas MD-835N-RAM,153/153(10)
226,06 Jun 2012,"Hualla Hualla, Mount Mamarosa, Peru HeliCusco",Sikorsly S-58ETOB-1840-P,14/14(0)
227,11 Jun 2012,"Near Serov, RussiaIllegal flight",Antonov An-2RRA-40312,13/13(0)
228,21 Jun 2012,"Jakarta, IndonesiaMilitary - Indonesian Air Force",Fokker F-27 Friendship 400MA-2708,7/7(4)
229,18 Aug 2012,"Off Masbate Island, PhilippinesAviatour's Fly'n Inc.",PA-34-200 Seneca IRP-C4431,3/4(0)
230,19 Aug 2012,"Talodi, SudanAlfa Airlines",Antonov An-26-100ST-ARL,32/32(0)
231,12 Sep 2012,"Near Palana, RussiaPetropavlovsk-Kamchatsky Air Enteprise",Antonov An-28RA-28715,10/14(0)
232,28 Sep 2012,"Kathmandu, NepalSita Air",Dornier 228-2029N-AHA,19/19(0)
233,07 Oct 2012,"Near Omdurman, SudanMilitary - Sudanese Air Force",Antonov An-12BPST-ASA,15/22(0)
234,07 Oct 2012,AntiguaFly Montserrat,Britten-Norman BN-2A-26 IslanderVP-MO,3/4(0)
235,21 Nov 2012,"San'a, YemenMilitary - Yemen Air Force",Antonov An-26420,10/10(0)
236,30 Nov 2012,"Near Brazzaville, CongoAero Service",Ilysushin Il-76TEK-76300,7/7(25)
237,05 Dec 2012,"Near Ladysmith, South AfricaMilitary - South African Air Force",Douglas C47-TP6840,11/11(0)
238,09 Dec 2012,"Near Iturbide, MexicoStarwood Management LLC",Learjet 25N345MC,7/7(0)
239,25 Dec 2012,"Near Shymkent, KazakhstanMilitary - Kazakhstan Border Guards",Antonov AN-72-100DUN-72859,27/27(0)
240,25 Dec 2012,"Heho, MyanmarAir Bagan",Fokker 100XY-AGC,1/71(1)
241,29 Dec 2012,"Moscow, RussiaRed Wings Airlines",Tupolev TU-204-100V RA-64047,5/8(0)
242,02 Jan 2013,"Near Clear Lake, IowaMed-Trans Corporaion",Bell 407N445MT,3/3(0)
243,04 Jan 2013,"Off Los Roques, VenezuelaTransaereo 5074",Britten Norman BN-2A-27 IslanderYV-2615,6/6(0)
244,29 Jan 2013,"Near Kyzyltu, KazakhstanSCAT Air",Canadair CRJ-200ERUP-CJ006,21/21(0)
245,13 Feb 2013,"Donetsk, UkraineSouth Airlines",Antonov AN-24RVUR-WRA,5/45(0)
246,04 Mar 2013,"Goma, CongoCompagnie Africaine d' Aviation (CAA)",Fokker 509Q-CBD,7/10(0)
247,08 Mar 2013,"Near Dillingham, AlaskaAce Air Cargo",Beechcraft 1900CN116AX,2/2(0)
248,13 Apr 2013,"Denpasar, IndonesiaLion Air",Boeing B-737-8GPPK-LKS,0/108(0)
249,29 Apr 2013,"Bagram Air Base, AfghanistanNational Air Cargo",Boeing B-747-428BCFN949CA,7/7(0)
250,31 May 2013,"Moosonee, OntarioOrnge Air Ambulance",Sikorsky S-76?,4/4(0)
251,25 Jun 2013,"Gaurikund, near Kedarnath, Uttarakhand State, India.Indian Air Force",MI 172 V5 helicopter?,20/20(0)
252,06 Jul 2013,"San Francisco, CaliforniaAsiana Airlines",Boeing B-777-28EERHL7742,3/307(0)
253,07 Jul 2013,"Soldotna, AlaksaRediske Air",de Havilland Canada DHC-3TN93PC,10/10(0)
254,09 Aug 2013,"Mogadishu, SomaliaMilitary - Ethiopian Air Force",Antonov An-12?,4/6(0)
255,14 Aug 2013,"Birmingham, AlabamaUnited Parcel Service",Airbus A300F-622RN155UP,2/2(0)
256,03 Oct 2013,"Lagos, NigeriaAssociated Aviation",Embraer 120RT Brasilia5N-BJY,16/20(0)
257,10 Oct 2013,"Kudat, MalaysiaMASwings",de Havilland Canada DHC-6 Twin Otter 3109M-MDM,2/16(0)
258,16 Oct 2013,"Near Pakse, LaosLao Airlines",ATR-72-50RDPL-34233,49/49(0)
259,03 Nov 2013,"Riberalta, BoliviaAerocon",Swearingen SA227-AC Metro IIICP-275,8/18(0)
260,09 Nov 2013,"Pujungan, Malinau district, BorneoMilitary - Indonesian Army",Mil- Mi-17B-5?,13/21(0)
261,10 Nov 2013,"Red Lake, Ontario, CanadaBearskin Airlines",Swearingen SA227-AC Metro IIC-FFZN,5/7(0)
262,17 Nov 2013,"Near Kazan, RussiaTararstan Airlilnes",Boeing 737-53AVQ-BBN,50/50(0)
263,29 Nov 2013,Glasgow ScotlandBond Air Services Ltd.,Eurocopter EC135 T2G-SPAO,3/3(5)
264,29 Nov 2013,"Bwabwata National Park, NambiaMozambique Airline",Embraer ERJ-190ARC9-EMC,33/33(0)
265,05 Dec 2013,"Near Cachimbo, BrazilHeringer Taxi Aero",Britten Norman BN-2A-3 IslanderPT-WMY,5/5(0)
266,26 Dec 2013,"Irkutsk, RussiaIrAvia",Antonov 1212162,9/9(0)
267,20 Jan 2014,Near Petreasa RomaniaScoala Superioara de Aviatie Civla,Britten Norman BN-2A-27 IslanderYR-BNP,2/7(0)
268,11 Feb 2014,"Near Ain Kercha, AlgeriaMilitary - Algerian Air Force",Lockheed C-130H-30 Hercules7T-WHM,76/77(0)
269,16 Feb 2014,"Sandhikhark, NepalNepal Airlines",de Havilland Canada DHC-6 Twin Otter 3009N-ABB,18/18(0)
270,21 Feb 2014,"Grombalia, TunisiaLibyan Air Cargo",Antonov 265A-DOW,11/11(0)
271,08 Mar 2014,South Indian OceanMalaysia Airlines,Boeing 777-2009M-MRO,239/239(0)
272,18 Mar 2014,"Seattle, WashingtonHelicopters Inc / KOMO TV",Urocopter AS350 B2N250FB,2/2(0)
273,19 Apr 2014,"Ramos Arizpe, MexicoLineas Aereas Comerciales",British Aerospace BAe 125-700A HawkerXA-UKR,8/8(0)
274,20 Apr 2014,"Jamijarvi, FinlandSuomen Urheiluilmailijat",Aerocomp Comp Air 8OH-XDZ,8/8(0)
275,08 May 2014,"Near San Vicente del Caguan, ColombiaAlisansa Colombia",Douglas DC-3CHK-4700,6/6(0)
276,17 May 2014,"Xiang Khouang province, LaosLaos Air Force",Antonov 74TK-300RDPL-34020,16/17(0)
277,14 Jun 2014,"Lugansk, UkraineMilitary - Ukraine Air Force",Ilyushin 76MD76777,49/49(0)
278,02 Jul 2014,"Near Nairobi, KenyaSkyward International Aviation",Fokker 505Y-CET,4/4(0)
