,Date,Location / Operator,Aircraft Type / Registration,Fatalities
279,07 Jul 2014,"Thach That district, VietnamMilitary - Vietnam People's Army Air Force",Mil Mi-171?,18/19(0)
280,17 Jul 2014,"Hrabove, UkraineMalaysia Airlines",Boeing 777-2H6ER9M-MRD,298/298(0)
281,23 Jul 2014,"Magong, TaiwanTransAsia Airways",ATR 72-500B-22810,48/58(0)
282,24 Jul 2014,"Aguelhok, MaliAir Algerie",Mc Donnell Douglas MD-83EC-LTV,116/116(0)
283,10 Aug 2014,"Tehran, IranSepahan Airlines",HESA Iran-140-100EP-GPA,39/48(0)
284,30 Aug 2014,"Tamanraset, AlgeriaUkraine Air Alliance",Antonov An-12BKUR-DWF,7/7(0)
285,31 Aug 2014,"Mwanza, TanzaniaSafari Express Cargo",Fokker F-27 MK 5005Y-SXP,3/3(0)
286,20 Sep 2014,"Near Port Moresby, Papua New GuineaHevlift",de Havilland Canada DHC-6 Twin Otter 300P2-KSV,4/9(0)
287,04 Oct 2014,"Wichita Falls, TexasAir Evac Lifeteam",Bell 206L?,2/4(0)
288,28 Dec 2014,"Near Uvira, CongoAir Sirin",Antonov An-264L-AFS,6/6(0)
289,28 Dec 2014,Java SeaAirAsia,Airbus A-320-216PK-AXC,162/162(0)
290,18 Jan 2015,"Near Abu adh Dhuhur Air Base, SyriaSyrian Air Force",Antonov An-26?,37/37(0)
291,04 Feb 2015,"Taipei, TaiwanTransasia",ATR 72-600B-22816,43/58(0)
292,10 Mar 2015,"Villa Castelli, ArgeninaPrivate",??,10/10(0)
293,24 Mar 2015,"Near Digne-Les-Bains, FranceGermanwings",Airbus A320-211D-AIPX,150/150(0)
294,25 Jun 2015,"Ella Lake, AlaskaPromech Air",de Havilland DHC-3T Vazar TurbineOtterN270PA,9/9(0)
295,30 Jun 2015,"Medan, IndonesiaMilitary - Indonesian Air Force",Lockheed C130-B HerculesA-1310,122/122(19)
296,31 Jul 2015,"Near Agustin Codazzi, ColombiaMilitary - Colombia Air Force",CASA CN-235-100FAC1261,11/11(0)
297,12 Aug 2015,"Ninia, IndonesiaKomala Air",Pacific AerospacePK-KIG,1/6(0)
298,16 Aug 2015,"Tangok mountain, PapuaTrigana Air Service",ATR 42-300PK-YRN,54/54(0)
299,05 Sep 2015,"Off Dakar, Near Dioubel, SenegalSenegalair",Hawker Siddeley HS-1256V-AIM,7/7(0)
300,15 Sep 2015,"Iliamna East Wind Lake, AlaskaRainbow King Lodge",de Havilland Canada DHC 3T Turbine OtterN928PK,3/7(0)
301,02 Oct 2015,"Jalalabad, AfghanistanMilitary - U.S. Army",Lockheed C-130J Hercules08-3174,11/11(2)
302,02 Oct 2015,"Near Masamba, IndonesiaAvistar Mandari",de Havilland DHC-6 Twin Otter PK-BRM,10/10(0)
303,31 Oct 2015,"Near Ilaga, IndonesiaTrigana Air Service",de Havilland DCH-4T CaribouPK-SWW,4/4(0)
304,31 Oct 2015,"Near Hasna, EgyptMetrojet",Airbus A321-231EI-ETJ,224/224(0)
305,04 Nov 2015,"Juba, South SudanAllied Services Limited",Antonov 12BKEY-406,41/43(0)
306,21 Nov 2015,"Fox Glacier, South Valley, New ZealandAlpine Adventures",Aerospatiale AS 350B2 EcureuilZK-HKU,7/7(0)
307,24 Nov 2015,"Near Igarka, RussiaTuruhan Avia",Mil MI-8TRA-2561,15/26(0)
